[
  {
    "id": "prism",
    "title": "PRISM: Reducing Spurious Implicit Biases in Vision-Language Models with LLM-Guided Embedding Projection",
    "authors": [
      "Mahdiyar Molahasani",
      "Azadeh Motamedi",
      "Michael Greenspan",
      "Il-Min Kim",
      "Ali Etemad"
    ],
    "equal_contribution": ["Mahdiyar Molahasani", "Azadeh Motamedi"],
    "year": 2025,
    "venues": [
      {
        "name": "International Conference on Computer Vision (ICCV)",
        "short": "ICCV",
        "year": 2025,
        "type": "conference"
      }
    ],
    "links": [
      { "label": "arXiv", "url": "https://arxiv.org/pdf/2507.08979" },
      { "label": "Code", "url": "https://github.com/MahdiyarMM/PRISM" }
    ],
    "image": "/images/PRISM_cover_sqr",
    "image_alt": "PRISM cover diagram",
    "tags": ["VLM", "Bias & Fairness", "CLIP", "ICCV"],
    "description": "PRISM introduces a data-free, task-agnostic debiasing framework for VLMs. It first leverages an LLM to generate bias-aware scene descriptions from simple class prompts, then learns a linear projection of the CLIP embedding space via a novel Latent-space Debiasing loss that enforces intra-class invariance and inter-class separability.",
    "bibtex": "@inproceedings{molahasani2025prism,\n  title={PRISM: Reducing Spurious Implicit Biases in Vision-Language Models with LLM-Guided Embedding Projection},\n  author={Molahasani, Mahdiyar and Motamedi, Azadeh and Greenspan, Michael and Kim, Il-Min and Etemad, Ali},\n  booktitle={Proceedings of the IEEE/CVF International Conference on Computer Vision (ICCV)},\n  year={2025}\n}",
    "highlight": true
  },
  {
    "id": "fedgala",
    "title": "Federated Unsupervised Domain Generalization using Global and Local Alignment of Gradients",
    "authors": [
      "Farhad Pourpanah",
      "Mahdiyar Molahasani",
      "Milad Soltany",
      "Ali Etemad",
      "Michael Greenspan"
    ],
    "equal_contribution": ["Farhad Pourpanah", "Mahdiyar Molahasani", "Milad Soltany"],
    "year": 2025,
    "venues": [
      {
        "name": "39th AAAI Conference on Artificial Intelligence",
        "short": "AAAI",
        "year": 2025,
        "type": "conference"
      },
      {
        "name": "NeurIPS Workshop on Mathematics of Modern Machine Learning (M3L)",
        "short": "NeurIPS M3L",
        "year": 2024,
        "type": "workshop"
      }
    ],
    "links": [
      { "label": "arXiv", "url": "https://arxiv.org/pdf/2405.16304" },
      { "label": "Code", "url": "https://github.com/MahdiyarMM/FedGaLA" }
    ],
    "image": "/images/FedGaLA_nb",
    "image_alt": "FedGaLA gradient-alignment diagram",
    "tags": ["Federated Learning", "Domain Generalization", "AAAI"],
    "description": "We introduced the novel problem of unsupervised federated domain generalization and proposed FedGaLA, a method that improves model generalization across unseen domains by aligning gradients at both the client and server levels. This work is grounded in a theoretical framework that links domain shift to gradient alignment. FedGaLA achieves state-of-the-art performance on several domain generalization benchmarks.",
    "bibtex": "@inproceedings{pourpanah2025fedgala,\n  title={Federated Unsupervised Domain Generalization using Global and Local Alignment of Gradients},\n  author={Pourpanah, Farhad and Molahasani, Mahdiyar and Soltany, Milad and Etemad, Ali and Greenspan, Michael},\n  booktitle={Proceedings of the AAAI Conference on Artificial Intelligence},\n  year={2025}\n}",
    "highlight": true
  },
  {
    "id": "fedsb",
    "title": "Federated Domain Generalization With Label Smoothing and Balanced Decentralized Training",
    "authors": [
      "Milad Soltany",
      "Farhad Pourpanah",
      "Mahdiyar Molahasani",
      "Michael Greenspan",
      "Ali Etemad"
    ],
    "equal_contribution": ["Milad Soltany", "Farhad Pourpanah", "Mahdiyar Molahasani"],
    "year": 2025,
    "venues": [
      {
        "name": "International Conference on Acoustics, Speech, and Signal Processing (ICASSP)",
        "short": "ICASSP",
        "year": 2025,
        "type": "conference"
      }
    ],
    "links": [
      { "label": "arXiv", "url": "https://arxiv.org/pdf/2412.11408" },
      { "label": "Code", "url": "https://github.com/miladsoltany/FedSB" }
    ],
    "image": "/images/fedsb_nob",
    "image_alt": "FedSB diagram",
    "tags": ["Federated Learning", "Domain Generalization", "ICASSP"],
    "description": "We propose FedSB, a method for federated domain generalization that improves model robustness across diverse domains using label smoothing to reduce local overconfidence and a balanced training mechanism to mitigate data heterogeneity.",
    "bibtex": "@inproceedings{soltany2025fedsb,\n  title={Federated Domain Generalization With Label Smoothing and Balanced Decentralized Training},\n  author={Soltany, Milad and Pourpanah, Farhad and Molahasani, Mahdiyar and Greenspan, Michael and Etemad, Ali},\n  booktitle={ICASSP 2025 - IEEE International Conference on Acoustics, Speech and Signal Processing},\n  year={2025}\n}"
  },
  {
    "id": "cltr",
    "title": "Continual Learning for Long-Tailed Recognition",
    "authors": ["Mahdiyar Molahasani", "Ali Etemad", "Michael Greenspan"],
    "year": 2023,
    "venues": [
      {
        "name": "NeurIPS Workshop on Mathematics of Modern Machine Learning (M3L)",
        "short": "NeurIPS M3L",
        "year": 2023,
        "type": "workshop"
      }
    ],
    "links": [
      { "label": "OpenReview", "url": "https://openreview.net/pdf?id=IfyZSIxcoM" },
      { "label": "Poster", "url": "https://neurips.cc/virtual/2023/81717" }
    ],
    "image": "/images/cltr",
    "image_alt": "Long-tailed recognition diagram",
    "tags": ["Continual Learning", "Long-Tailed", "NeurIPS"],
    "description": "This work presents a theoretical framework for addressing long-tailed recognition (LTR) through continual learning (CL), where models are trained sequentially on data subsets to balance performance across head (frequent) and tail (rare) classes. By proving bounds on model weight updates and demonstrating CL's effectiveness on benchmark datasets, we show that CL can significantly improve LTR performance.",
    "bibtex": "@inproceedings{molahasani2023cltr,\n  title={Continual Learning for Long-Tailed Recognition},\n  author={Molahasani, Mahdiyar and Etemad, Ali and Greenspan, Michael},\n  booktitle={NeurIPS Workshop on Mathematics of Modern Machine Learning (M3L)},\n  year={2023}\n}"
  },
  {
    "id": "citpersons",
    "title": "Continual Learning for Out-of-Distribution Generalization in Pedestrian Detection",
    "authors": ["Mahdiyar Molahasani", "Ali Etemad", "Michael Greenspan"],
    "year": 2023,
    "venues": [
      {
        "name": "International Conference on Image Processing (ICIP)",
        "short": "ICIP",
        "year": 2023,
        "type": "conference"
      }
    ],
    "links": [
      { "label": "arXiv", "url": "https://arxiv.org/abs/2306.15117" },
      { "label": "IEEE", "url": "https://ieeexplore.ieee.org/abstract/document/10222758" },
      { "label": "Code", "url": "https://github.com/MahdiyarMM/Continual-pedestrian-detection" }
    ],
    "image": "/images/citpersons",
    "image_alt": "Pedestrian detection samples",
    "tags": ["Continual Learning", "Object Detection", "OOD", "ICIP"],
    "description": "This study introduces the first continual learning approach for pedestrian detection that can effectively address distribution shift, a common issue in prior works. We proposed modified Elastic Weight Consolidation for object detection networks, enabling the model to maintain its performance across different datasets and significantly improve the miss rate on CrowdHuman and CityPersons datasets by mitigating catastrophic forgetting.",
    "bibtex": "@inproceedings{molahasani2023citpersons,\n  title={Continual Learning for Out-of-Distribution Generalization in Pedestrian Detection},\n  author={Molahasani, Mahdiyar and Etemad, Ali and Greenspan, Michael},\n  booktitle={2023 IEEE International Conference on Image Processing (ICIP)},\n  year={2023}\n}"
  },
  {
    "id": "crowd",
    "title": "Multi-scale Multi-task Crowd Counting",
    "authors": [
      "Mohsen Zand",
      "Haleh Damirchi",
      "Andrew Farley",
      "Mahdiyar Molahasani",
      "Michael Greenspan",
      "Ali Etemad"
    ],
    "year": 2022,
    "venues": [
      {
        "name": "International Conference on Acoustics, Speech, and Signal Processing (ICASSP)",
        "short": "ICASSP",
        "year": 2022,
        "type": "conference"
      }
    ],
    "links": [
      { "label": "arXiv", "url": "https://arxiv.org/abs/2202.09942" },
      { "label": "IEEE", "url": "https://ieeexplore.ieee.org/document/9747776" },
      { "label": "Code", "url": "https://github.com/MahdiyarMM/crowd_counting" }
    ],
    "image": "/images/crowd",
    "image_alt": "Crowd counting visualization",
    "tags": ["Crowd Counting", "Multi-task", "ICASSP"],
    "description": "A multi-scale crowd counting and localization platform is proposed in this work. This novel architecture alongside the multi-scale multi-task loss function has demonstrated promising performance on standard benchmarks.",
    "bibtex": "@inproceedings{zand2022crowd,\n  title={Multi-scale Multi-task Crowd Counting},\n  author={Zand, Mohsen and Damirchi, Haleh and Farley, Andrew and Molahasani, Mahdiyar and Greenspan, Michael and Etemad, Ali},\n  booktitle={ICASSP 2022 - IEEE International Conference on Acoustics, Speech and Signal Processing},\n  year={2022}\n}"
  },
  {
    "id": "msg",
    "title": "MSG-Caps GAN for Face Super-Resolution",
    "authors": ["Mahdiyar Molahasani", "Seok-bum Ko"],
    "year": 2020,
    "venues": [
      {
        "name": "International Conference on Electronics, Information, and Communication (ICEIC)",
        "short": "ICEIC",
        "year": 2020,
        "type": "conference"
      },
      {